{
  "$schema": "http://json-schema.org/schema#",
  "$id": "http://localhost:3000/placesInputSchema.json",
  "title": "Protest movements with a place",
  "description": "Protest movements with a place",
  "type": "array",
  "items": {
    "type": "object",
    "properties": {
      "movementName": {
        "type": "string"
      },
      "description": {
        "type": "string"
      },
      "links": {
        "type": "array",
        "items": { "type": "string" }
      },
      "startYear": {
        "type": [ "number", "null" ]
      },
      "endYear": {
        "type": [ "number", "null" ]
      },
      "placeName": {
        "type": "string"
      },
      "latitude": {
        "type": "number"
      },
      "longitude": {
        "type": "number"
      }
    },
    "required": ["movementName", "placeName", "latitude", "longitude"],
    "additionalProperties": false
  }
}